{
  "sharedStateURL": "http://localhost:4500/state/q1w2e3r4",
  "name": "test-person-happy-path",
  "description": "run through person commands",
  "steps": [
    {
      "enabled": true,
      "name": "list",
      "tasks": [
        {
          "tag": "person",
          "service": "person",
          "input": {
            "command": "list",
            "resource": "person"
          },
          "storeResultAt": [
            {
              "targetPath": "/state/personList"
            }
          ]
        },
        {
          "enabled": true,
          "tag": "person",
          "service": "person",
          "input": {
            "command": "status",
            "resource": "person",
            "id": "q1w2e3r4",
            "payload": {
              "status": {
                "$fromState": "/personData/status",
                "default": "active"
              }
            }
          },
          "storeResultAt": [
            {
              "targetPath": "/state/personStatus"
            }
          ]
        },
        {
          "tag": "person",
          "service": "person",
          "input": {
            "command": "read",
            "resource": "person",
            "id": "q1w2e3r4"
          },
          "storeResultAt": [
            {
              "targetPath": "/state/personRead"
            }
          ]
        }
      ]
    }
  ]
}
